commentID,comment_text,hate_instigation_level,hatespeech_or_not
UgyxzOcBA3kK6jIXJpt4AaABAg,"<i>As He sat on the Mount of Olives, the disciples came to Him privately, saying, “Tell us, when will these things be, and what will be the sign of Your coming and of the end of the age?” Jesus answered them, </i><b><i>“Take heed that no one deceives you. For many will come in My name, saying, ‘I am the Christ,’ and will deceive many. You will hear of wars and rumors of wars. See that you are not troubled. For all these things must happen, but the end is not yet. For nation will rise against nation, and kingdom against kingdom. There will be famines, epidemics, and earthquakes in various places. All these are the beginning of sorrows. “Then they will hand you over to be persecuted and will kill you. And you will be hated by all nations for My name’s sake. Then many will fall away, and betray one another, and hate one another. And many false prophets will rise and will deceive many. Because iniquity will abound, the love of many will grow cold. But he who endures to the end shall be saved. And this gospel of the kingdom will be preached throughout the world as a testimony to all nations, and then the end will come.</i></b><i> Matthew 24:3‭-14 MEV</i>
<br>(Obs: From the beginning of the tribulation to the end, which takes 7 years, and near the end, the gospel will be preached to the whole world, which would be impossible without technology of global communication)
<br>
<br><b><i>“When you see Jerusalem surrounded by armies, then you know that its desolation has drawn near.</i></b><i> Luke 21:20 MEV</i>
<br><b><i>“So when you see the ‘abomination of desolation,’ spoken of by Daniel the prophet, standing in the holy place,(...)</i></b><i> Matthew 24:15 MEV</i>
<br><i>“His armies shall rise up and desecrate the sanctuary fortress. They shall abolish the daily sacrifice and set up the abomination that makes desolate. Daniel 11:31 MEV</i>
<br><i>“From the time that the daily sacrifice shall be taken away and the abomination that makes desolate set up, there shall be one thousand two hundred and ninety days. Daniel 12:11 MEV</i>
<br>(Obs: These events will take place after the construction of the third temple of Solomon in Jerusalem)
<br> <b><i>(...)then let those who are in Judea flee to the mountains. Let him who is on the housetop not go down to take anything out of his house. Let him who is in the field not return to take his clothes. Woe to those who are with child and to those who nurse in those days! Pray that your escape will not be in the winter or on the Sabbath. For then will be great tribulation, such as has not happened since the beginning of the world until now, no, nor ever shall be. “Unless those days were shortened, no one would be saved. But for the sake of the elect those days will be shortened.</i></b><i> Matthew 24:16‭-22 MEV</i>
<br>
<br><b><i>There will be signs in the sun and the moon and the stars; and on the earth distress of nations, with perplexity, the sea and the waves roaring; men fainting from fear and expectation of what is coming on the inhabited earth. For the powers of heaven will be shaken.</i></b><i> Luke 21:25-26 MEV</i>
<br><b><i>“Immediately after the tribulation of those days, ‘the sun will be darkened, the moon will not give its light; the stars will fall from heaven, and the powers of the heavens will be shaken.’ “Then the sign of the Son of Man will appear in heaven, and then all the tribes of the earth will mourn, and they will see the Son of Man coming on the clouds of heaven with power and great glory. And He will send His angels with a great sound of a trumpet, and they shall gather His elect from the four winds, from one end of the heavens to the other.</i></b><i> Matthew 24:29‭-31 MEV</i>
<br><b><i>When these things begin to happen, look up and lift up your heads, for your redemption is drawing near.</i></b><i> Luke 21:28 MEV</i>
<br>
<br><b><i>Because you have kept My word of patience, I also will keep you from the hour of temptation which shall come upon the entire world, to test those who dwell on the earth.</i></b><i> Revelation 3:10 MEV</i>
<br>(Obs: Rapture before the time of temptation, which will be the government of the antichrist during the great tribulation)
<br>
<br><i>For the Lord Himself will descend from heaven with a shout, with the voice of the archangel, and with the trumpet call of God. And the dead in Christ will rise first. 1 Thessalonians 4:16 MEV</i>
<br>(Obs: Rapture)
<br>
<br><b><i>For as in the days before the flood, they were eating and drinking, marrying and giving in marriage, until the day Noah entered the ark, and did not know until the flood came and took them all away, so will be the coming of the Son of Man.</i></b><i> Matthew 24:38‭-‬39 MEV</i>
<br>(Obs: People will not be eating and drinking and marrying during the great tribulation, therefore, rapture will happen before the great tribulation, when people are still distracted)
<br>
<br><i>When they say, “Peace and safety!” then sudden destruction will come upon them as labor upon a woman with child, and they shall not escape. 1 Thessalonians 5:3 MEV</i>
<br>(Obs: Sudden destruction near the rapture)
<br>
<br><b><i>Two will be in the field; one will be taken, and the other left. Two women will be grinding at the mill; one will be taken, and the other left.</i></b><i> Matthew 24:40‭-41 MEV</i>
<br>(Obs: Rapture)
<br>
<br><i>Know this first, that there shall come scoffers in the last days who walk after their own lusts, and say, “Where is the promise of His coming? For since the fathers fell asleep, all things have continued as they were since the beginning of the creation.” 2 Peter 3:3‭-4 MEV</i>
<br>(Obs: Apostasy of the last days, when more and more men are denying God and going after their own sinful desires)
<br>
<br><i>But the day of the Lord will come like a thief in the night, in which the heavens will pass away with a loud noise, and the elements will be destroyed with intense heat. The earth also and the works that are in it will be burned up. 2 Peter 3:10 MEV</i>
<br>(Obs: The destructions that will happen after the rapture, just as the days of Sodom and Gomorrah; the righteous are rescued and the judgements are poured upon the wicked. &quot;like a thief in the night&quot; means it will happen when you do not expect. &quot;heavens will pass away&quot; means the sky will vanish as a scroll that is being rolled up, which is mentioned in Revelation 6:14)
<br>
<br><i>He causes all, both small and great, both rich and poor, both free and slave, to receive a mark on their right hand or on their forehead, so that no one may buy or sell, except he who has the mark or the name of the beast or the number of his name. Revelation 13:16‭-17 MEV</i>
<br>(Obs: In the last days, no one will be able to buy or sell without a mark from the government/beast of the antichrist, which will take place during the great tribulation, which is at the door)
<br>
<br><i>But you, Daniel, shut up the words and seal the book until the time of the end. Many shall run to and fro, and knowledge shall increase.” Daniel 12:4 MEV</i>
<br>(Obs: In the last days, many will travel to many places and knowledge will be increased)
<br>
<br><b><i>“For God so loved the world that He gave His only begotten Son, that whoever believes in Him should not perish, but have eternal life.</i></b><i> John 3:16 MEV</i>
<br>
<br>Behold, the Lord of lords is coming soon, repent now of all your sins —stay away from all sins— and abide in the only Savior and Lord Jesus, the Christ, (Yeshua, the Messiah) with all your heart, for the kingdom of heaven is at hand.",0.0,0
UgxP3jSZttkuZpD3RHJ4AaABAg,Blame Russia!,1.0,1
UgyEl_Mx-SCvRH0ZsG94AaABAg,"Brian Stelter blames this week&#39;s HAARP tornado outbreak on Trump and Putin. Brandon heads to Popeye&#39;s Louisiana Chicken after a long Delaware Beach weekend to deliver an inspiring message of unity telling NOLA residents it&#39;s time to lower their expectations. 📺🐑 <a href=""http://www.youtube.com/results?search_query=%23lgbfjb"">#LGBFJB</a>+ 📺🐑",0.0,0
UgxcuDs4auPwcgEV6ap4AaABAg,Can we all say:   Climate Change,0.0,0
Ugwu4SVF4-dwXLvyGLx4AaABAg,Can’t Joe Biden just take a Sharpie and change the path that the tornado took??<br>Because I’ve seen something like that done with a hurricane before.,0.6,0
UgytanCRqQs2gU7GX4l4AaABAg,Don&#39;t give Trump a sharpy again!,1.0,0
UgxNxPS3SeYS9aj_tGt4AaABAg,FJB - Let&#39;s go Brandon 🇺🇸,1.0,0
Ugwtq2RdHnNaITCxE3x4AaABAg,Good News. God punishes liars and democracy 😂,0.5,0
UgzDmWPpqpF_5S2OcgN4AaABAg,Hi CNN I don’t even trust you with weather reporting.,1.0,1
UgzKTzgg5RUtE9Gxz0p4AaABAg,"Hurricanes, floods, tornadoes, high crime, horrible weather/high humidity, poverty, debauchery, federal assistance galore…this place seems like hell.",0.0,1
UgxwwFWnkEkd6N1O3oZ4AaABAg,"I just wanted to thank hunter Biden for leaving his laptop with a human.<br>CNN, you stanky.",1.0,1
UgyHWvM9i6yqWc2yPwV4AaABAg,"I simply can&#39;t understand why you Americans keep building houses made of wood in areas known to be affected by tornadoes... it&#39;s insane!!!<br>It&#39;s like making the same mistake, over and over again, hoping to get a different result...",0.0,1
UgxaYCRl6Yvm89GoUmp4AaABAg,It always shatters my heart when this happens... I&#39;m from Massachusetts and would take a blizzard any day over those tornados and hurricanes.. my heart is with all the families and I&#39;ll definitely be donating. Hug your loved ones tight today. 🥺❤️,0.14285714285714285,0
UgxK2zyWeQye7vHCZP14AaABAg,"It&#39;s Putin&#39;s fault again, he sent a tornado 😂🖕right,girls?",1.0,1
UgxjEw_tcZlQYDua-0B4AaABAg,It&#39;s hard to imagine the devastation that the tornado caused this town. I hope all these people are okay.,0.0,0
Ugwy5AfGqu1xCy3qhvR4AaABAg,Libs have already blamed climate change for this,0.0,0
Ugzwntea0Xa0h6oGl7x4AaABAg,Louisiana is just one of those States you take a risk living in lol,1.0,1
UgwlH7ek9zLzXo76w4x4AaABAg,Love you New Orleans. Praying for y’all.,1.0,0
Ugz7_0yZMlTZsUJVszx4AaABAg,Multiply this by 1000 to understand what Putin has done to Mariupol in Ukraine.,1.0,0
Ugx-7F0uixFYXZK8B8p4AaABAg,"No basements or underground shelters in New Orleans, they are below or at sea level.",0.0,0
Ugy76kzKFv4PHOAc8JZ4AaABAg,"Not even close to Ukraine, Mariupol after puthlers bombarding...<br><br>But still, my condolences to all who suffers from this tornado!",0.0,0
UgwuAoGZUWcSNyHz4C14AaABAg,"Omg, the BBB BILL would&#39;ve prevented this 😆 🤣 😂",0.5,0
UgzWQgqQ805EjUUzHBx4AaABAg,Sending prayers to all,0.0,0
UgzA_bQ-_fWE1H46uUV4AaABAg,"Spectacularly descriptive reporting, Next you&#39;ll tell us that rain falls from the sky!",1.0,1
UgwxbuhVGKXXijqtwzJ4AaABAg,Thanks Biden,1.0,0
UgxQkfnHkQjXiFdz2i94AaABAg,That Tornado voted for Biden. Sadly.,1.0,1
UgxvUHtNdeZpXzxBc6Z4AaABAg,The significance of the passage of time. Right?<br>The significance of the passage of time.<br>Kackela,1.0,0
UgyX0WAG9HUtKhaVERR4AaABAg,"There are no miracles, only events that happen to be fortunate or unfortunate. Tornados travel a path, ergo the property destroyed is in the path and the property that is not in the path is not destroyed. That is the usual event. I live 80 miles from New Orleans and can attest that we suffered a terrific storm yesterday. I am among those who were fortunate not to be in the path of a tornado and will endeavor to help those who were unfortunate enough to suffer damage and injury. Nature is a force we all have lived with and will never be able to control.",1.0,0
UgwXA3NnxDVQywNsu8p4AaABAg,This channel sucks and should be banned by youtube!,1.0,1
UgxL4n5zaFWkxYYITjF4AaABAg,"This doesn’t appear to me to be New Orleans CITY. Homes in New Orleans do not have large yards. This seems to be a suburb. I’m grateful as someone who was raised in New Orleans city that it doesn’t appear that this tornado hit the downtown area or any of the neighborhoods. I’ll continue to watch to determine the extent of damage to the city. When you first reported New Orleans, my mind reflected on close built housing in downtown area in French quarter.",0.0,0
Ugzcyx3cGIn3hJ3y4mB4AaABAg,This is so scary..tornados are happening more and more...I am from Ontario and we never had many tornadoes....now it&#39;s more and more. More ice storms...more wind storms ect.. And still there are people that think their is no global warming...,0.4166666666666667,0
UgzgukfMvCk5YAteq194AaABAg,This storm and a tornado came by my house day before yesterday and I too could feel the pressure in the air change. Its weird. It starts to feel like everything is about to float away and something in the atmosphere changes. So bizarre.,0.0,0
UgwtriaNp2vFnFCAaop4AaABAg,"Until the next event in that area, move away people !.",0.0,0
Ugxvm-3GCkElXti8it94AaABAg,Use the money that we are wasting in Unkaine on helping our own in New Orleans.,0.0,0
UgzZmLGnTTyKq9NYiiF4AaABAg,WHY ISN&#39;T CNN COMMENTING ON Chris Cuomo&#39;s lawsuit against them? 🤔🤔🤔🤔🤔,0.3333333333333333,0
UgysQnYToM-NqqxdJTp4AaABAg,Wait where was god when this happened?  Damn sure not in the ukraine,0.0,1
UgxeYWgvJw75pSAxo8R4AaABAg,"Well thank God we have $6.00 gas, that should reduce travel C02 and tornadoes.  thank you Brandon",1.0,1
UgwsvnpXUsD1Y_zTpDp4AaABAg,"Wow I didn&#39;t even know New Orleans could get a tornado. It&#39;s bad enough they get hurricane season every year.  Most places don&#39;t get 2 of the 3 major nature events. Tornadoes, hurricanes and earthquakes...",0.0,0
Ugwhrd9CQglVPR8wHTF4AaABAg,"You don&#39;t get to do the news anymore. Remind us how &quot;everything&quot; is Trump&#39;s fault losers!  Russian Operative. You lost all credibility, and we are watching you FAIL. You would triple your viewership if you did real news like investigate lying cheating Hillary. Russian Operative. You didn&#39;t give the man a chance and said horrific and TRAITORIST lies. We won&#39;t just blow this off. Now Hunters Laptop!!!",0.75,1
UgyevflTptGkNb0I4eB4AaABAg,better give credit unto whom credit is due! GOD!!,0.0,0
UgyXUhvzcazfmvYZsY94AaABAg,why not use reinforced concrete instead of wood in those areas (tornado alley),0.14285714285714285,0
Ugw5JDi0U0FwuLDI6594AaABAg,🙏🏾,0.0,0
UgyKv9LDQFdDvQmQLR54AaABAg,1.Forensic autopsy these are facts in the case this is the only thing you look at in the case are the facts Fact one by the forensic specialist two places on the black man&#39;s body were mere fragments from a shotgun blast hit the body which the forensic specialist said didn&#39;t make any sense because these are not the kind of blasts that a malice murderer would use<br>2. That&#39;s why the forensic specialist said it didn&#39;t make any sense until he seen the video coverage of Ahmaud attacking the white individual with the shotgun! When the forensic specialist saw the wrestling match scuffle of the two wrestling over the shotgun the white individual said he pulled the trigger one time because his finger is caught around the trigger Ahmaud during the wrestling match scuffle shot the shotgun twice in order for this to be malice murder the white individual had to take one shotgun blast the full blast of the shotgun and shoot it through the blackbody of Ahmaud that would have been an outright malice murder but according to the forensic specialist in according to the video coverage none of this malice murder took place! This bad prosecutor has tried to pull something on the whole United States of America that is watching to see who is smart and who is dumb and so far they&#39;ve made the whole news media and everyone in the United States look dumb as they can be the smarter people of the United States of America is not going to let this bad prosecutor pull this stunt with this bad courtroom and a bad jury that wanted to go home for the holidays) in order to have a malice murder it had to take a whole shotgun blast to the body in other words they outright murdered the man they blew his head off) this did not take place! In the video coverage that shows Ahmaud attacking the white individual with the shotgun which caused the wrestling match scuffle over the shotgun the white man admitted he shot the gun one time this means that Ahmaud shot the gun 2 times because there was three shotgun blast during the wrestling match scuffle over the firearm it appears that all three individual white people had firearms if it was malice murder they would have all blew holes through Ahmaud this would have been a malice murder so under the facts of the case there is no way we can pull malice murder and now you have a malicious prosecution with the wrong charges on three individuals the shotgun was the only one shot three times the white man on the witness stand emitted of shooting the gun one time during the wrestling match scuffle of the firearm based on these facts there is no malice murder involved but now you have a malicious prosecution and a bad prosecutor that just wanted to win a case and you have a bad jury that just wanted to go home for the holidays that didn&#39;t appear to have the intelligence to go through the factual evidence and information,1.0,1
Ugw5CeAc0yeFae1CJ094AaABAg,"All of this wouldn’t of happened and ahmaud would still be alive today had not been caught on camera trespassing snooping and looking around on private property and continued with his jogging in the first place so stop defending a criminal based off the color of his skin but again, I’ll wait🍿😘😉🤣.",0.0,0
UgwMJyQsuafpUwL8JnV4AaABAg,"All people have prejudice towards others, now it&#39;s a crime.",0.0,0
UgwNztytCM9CFSgENRp4AaABAg,Are you telling me that in the entire history of America not one black person has been prosecuted with the same hate crime that these men were prosecuted under.  Equity I think not.  Political grandstanding playing for the mob is what happened to these killers.  Talk about a lynching.,0.0,0
UgyQvTQL4_v_ct_R7VN4AaABAg,"As a society we are perilously close to adopting the Orwellian concept of &quot;thought crime&quot;. Did, or did not, these men murder Mr. Arbery? If so then what they believe about &quot;race&quot; is irrelevant. The criminality is in what they did.",0.0,0
UgyH7uAUOqus4xFnWWV4AaABAg,"Assuming CNN is around in another year, history will despise the execs behind American media, incompetent biased reporting has done great harm to this country, retribution will find you sleazy gremlins.",0.0,1
UgxFpdpwpOf3Yebd-xF4AaABAg,BLM is so desperate to extend their victimhood they have to eavesdrop on private conversations.,0.0,0
Ugy773AyAcWCWrVYFmZ4AaABAg,CNN FAKE NEWS running on someone&#39;s lawn is not a crime and he had plenty of places to go .,1.0,1
Ugw0fWvdpwYGLKM5dad4AaABAg,"CNN has to tell biden to turn on our pumps JPMorgan says oil will go up to 120 dollars a gallon that will cost us 7,00 a g a long. Biden is f----no up the us",0.0,1
Ugxegsy0ap9EFBsfDQt4AaABAg,CNN posting an old case to sew that hate division…good times,0.5,1
UgxilMsUZakS-75yNxN4AaABAg,"Dear racists,<br>   Dont hate us.. Instead hate your ancestors for being to lazy to build their own society. We&#39;re the only ethnic group in America that did not choose to be here. <br>                 -- Love, The Original Humans,",1.0,1
UgwYLDJ_bcuDL7RM9jt4AaABAg,Even if it&#39;s heinous it doesn&#39;t mean its wrong,0.0,0
Ugx50r-vmb6kaMQ7dgh4AaABAg,Federal prison is better. That&#39;s what they wanted.,0.3333333333333333,0
UgwP-U02eOgahpn0YQ14AaABAg,"For those who thought that this was a racist act, you’re racist for evening thinking of that to begin with. Funny how they never brought up why did ahmaud stopped jogging and went snooping around on private property that he had no business being on when he was clearly caught on camera doing it. Only one answer to that folks, cause he was looking for expensive stuff to steal. Camera’s never lie. Think about it, he would of probably still been alive today if he had continued his jogging and never stopped to do that.",0.6666666666666666,1
Ugzie-fd6dGYmLXZTnB4AaABAg,"Give them NO special treatment NONE, MURDERS...",1.0,0
UgxaC7biW6R3Rpj3vL94AaABAg,"God is good, all the time !!!!!!",0.0,0
UgyHyAmY2XsMfpLu08R4AaABAg,Great stuff. I watch several youtube videos on how to trade in the stock market but haven&#39;t made any head start because they are either talking some gibberish or sharing their story of how they made it and I do not want to make mistakes by taking risks in my own hands.,0.0,0
UgzQ0w1Pl84YLPhWwQZ4AaABAg,How dare those three men try to ID a serial trespasser who was just jogging! Some people think Ahmaud Arbery&#39;s phone text messages would prove that he was just jogging but it wasn&#39;t allowed in court because of institutional racism. Why wasn&#39;t his own phone records allowed in court to completely exonerate him and remove any suspicious some people still might have?,0.1111111111111111,0
UgzFmdHU0TPhKtwmMIp4AaABAg,I THINK THE MOST SADDEST THING ABOUT THIS EVER IS THE FACT THAT THERE ARE STILL MANY PEOPLE OUT HERE WHO THINK THEY&#39;RE ARE INNOCENT SMH...,0.0,0
Ugwxcw4YqmlPPH3Nu_V4AaABAg,I live in Jacksonville fl and I been following this from day one.  They need to stop messing around with this and dump all three in jail for good  .,0.0,0
UgwcLzUQAjZ3Cc7JNUJ4AaABAg,I miscarriage of justice that stinks to high hell.,0.0,0
Ugzuov_irI9Ooxl0xnF4AaABAg,I&#39;m confused. A federal hate crime? Where? Where is it against the law to express hate against black people in America?<br>What&#39;s the legislative code #?<br>There&#39;s an open door to challenge a charge.<br>Tell me the Federal code that prevents having your way at the expense of the nearest black person that someone near wants to f**k with...,0.0,0
UgwwaGjkLXzhEg_3y014AaABAg,Im so happy these guys are where they belong.  Hope they get what they got coming to them up in there.  Especially the McMichael.,0.0,0
Ugzhb4oG_OKOXPGk0XN4AaABAg,Impossible. The Republican party and the Supreme Court have both officially declared racism over. Isn&#39;t it illegal now to even discuss hate crimes?,1.0,0
UgzXinxEurBGJejd8y14AaABAg,In that case 90 percent of police interactions are hate crimes,0.0,0
UgyHg-ygGCHexzius1F4AaABAg,It seems like most people have been commenting buying the narrative for one he was in a house he had no business being in second he wasn&#39;t cornered he had plenty of ways to keep on going which brings third he chose to stop turn around and attack a man holding a shotgun so what would have happened if he took shotgun from that guy?the trial also didn&#39;t allow police footage of aumaud auberry in a park being questioned by a officer and almost having to be tased for being beligerant towards the officer for asking him a simple question about being reported to 911 ii don&#39;t see how this is a hate crime when video clearly showed him trespassing at a residence that had been burglarized earlier l seriously don&#39;t feel like they were out hunting black men nor do I think they would have shot him if he didn&#39;t attack someone with a gun I don&#39;t see cold blooded murder whatsoever I see a country who wants to villifie whitey and coddle criminals I&#39;m sure I will be called a racist but whatever I&#39;m just not a sheep and don&#39;t say what I don&#39;t feel just a word to the wise if you want to protect your property or neiborhood make sure they are your same color otherwise take the loss or call police if you can,0.0,0
UgxnRKMWHyP9t_Uz50x4AaABAg,It’s getting harder and harder for me to like white people.,0.2,1
UgxSHYrR2e3HDJvaR7l4AaABAg,Justice won&#39;t be served until every gang banger and cartel member in this country is dead or in prison. Time for all out military extermination of narco terrorists.,0.5,0
Ugy1WPiks5aELyGgayd4AaABAg,Leftist swine are inciting exactly what they want. War.,0.0,1
UgyEQJqPc7CZZRkClDx4AaABAg,"Look at those faces, it is finally realization of how cruel there hate fullness was or is it well now I got caught and not I have to pay.? Lord Jesus truly the Judas&#39;s of this world. Just as they stabbed and taunted Jesus they did the same thing. My heart is so heavy that such hate exist in this day and age.😪😪😪😥",0.0,0
Ugz2HMYCb_VCoV56nVp4AaABAg,Lowlifes got life. 😂,0.0,0
UgzsbMdWiH6QprhtmZ94AaABAg,Malice murder on the Georgia law book says if it&#39;s expressed or applied the man expressed that he would shoot him in self-defense but none of this took place it was an accidental shooting due to a wrestling match scuffle over a firearm misrepresentation in the courtroom,0.0,0
UgwBRl7ApbZUO-WPny54AaABAg,"Meanwhile, backls <b>STILL</b> hold the record, per capita, for highest real <b>AND</b> fake hate crimes committed. (Intentional typos for the YouTube censors).",0.0,0
UgzmR3bADClw25RC_-F4AaABAg,"None of this wouldn’t of happened and ahmaud would still be alive today had not been caught on camera trespassing snooping and looking around on private property and continued with his jogging in the first place but again, I’ll wait🍿😘😉🤣.",0.0,0
UgyhOLdehooWUoVwNBt4AaABAg,People have been using the definition about racism wrong for so many years that  dictionaries have actually updated their definition to match current public sentiment about the meaning.  We keep finding ways to divide our country.,0.0,0
UgwVE3_6GmSJhkhzZ514AaABAg,Sad day in America you cannot defend yourself against criminals this kid had a chance to run away he chose to attack a men with a gun BS,0.1111111111111111,1
