commentID,comment_text,hate_instigation_level,hatespeech_or_not
UgxgmXMTgbnAc1pWR0F4AaABAg,"<b>Pilot:</b> &quot;I&#39;m 42 years old and was force-vaccinated, and now I&#39;m having chest pains&quot;<br><b>Media:</b> &quot;We have no idea what happened&quot;",1.0,0
UgwXV1KXl6paMzfF3R14AaABAg,"Allegedly, the third pilot, who was only there for &quot;extra experience&quot; was also <b>the most experienced there, by far. So experienced, he had actually trained the other two pilots present</b><br><br>Hmmm....  🤔",0.0,0
UgzfOAYjYPJGjsJxt5d4AaABAg,Article 1 of the constitution of the people&#39;s Republic of China! All rights belong to the people! The XI jin ping  government violates the Constitution! What should we do?,0.0,0
Ugyp7kWbXUQGWj49QsN4AaABAg,Boeing is obviously creating shit planes. Its time to take a look at that company,1.0,0
UgzuDvs_NommE3MHtGF4AaABAg,"He can say apple’s and oranges, I’m not getting on a 737 , I will choose an airline with Air Bus",0.0,0
UgzuAVPKijtvtt86UVZ4AaABAg,"Here&#39;s my thought, when are we going to stop hearing ,&#39; this is the safest &quot; , ? Something&#39;s very wrong with this plane ? How many more crashes will we the world except ? My heart goes out to the people of this flight ! No lift control ? How many hours on the plane ? Maintenance on the plane ? Profit before safety ?  🤔 Just thinking as a human . Please don&#39;t blame the flight crew ,they didn&#39;t build the plane !",0.4,0
Ugyf4XXSVnQ6g-P_-mB4AaABAg,Holy shit that is intense,0.0,1
Ugw6UzLX97YbUxyps-Z4AaABAg,"Look like it was doing Flight 93, 9/11 imitation in Pennsylvania , just saying ???",0.0,0
UgxLR0l-MH6sfVCP6Yt4AaABAg,Plane infected by corona China will suffer more bcos of corona million people hve die no regret,0.0,1
UgznnhKvSBTtkAOyVyx4AaABAg,Suicide ?,0.5,0
Ugwnu6DPjQExTcb4NNx4AaABAg,That sudden steep nose dive of an intact and relatively new jet indicates system failure<br>1.Mcas system confusion-2 similar 737-800 max crashes not long ago-most likely. <br>2.Suicide<br>3.Hijacking. It&#39;s very scarry. I can&#39;t imagine the horror they all went through seconds before it hits the ground. I just wish they were all asleep when that happened.,0.0,0
UgxcSiqqVpBARzx64Ut4AaABAg,"That wasn&#39;t &quot;falling from the sky&quot;, that was rapidly flying to the ground.",0.0,0
UgyTng21QPw6kSVxSL54AaABAg,That’s good 132 less people to worry about 😂,1.0,0
UgwCj0UuS81elS1Mxr94AaABAg,"The safety record of this aircraft is truly amazing. Anything is possible, but it is highly unlikely there is a design defect that caused the crash.",1.0,0
UgyuxE7uG53aGEget-J4AaABAg,"The way it was angled at almost ninety degrees is really baffling, it first made me think of germanwings flight 9535.   I’ve read that both black boxes were recovered, so hopefully they weren’t too badly damaged and can provide data to show why the flight crashed that way. <br>For the sake of the grieving family and friends and the safety of future fliers, the public needs answers.",0.18181818181818182,0
UgxbyTHvcyodBY5lkQ54AaABAg,These are terrorist attacks not suicide. Why would the pilot want to kill hundreds of others that&#39;s not how suicide works.  These are home grown terrorists doing the deed right under everyone&#39;s nose. People who are suicidal are pretty out of it at that point and they are not going to fly a plane and then do it. They are going to do it when alone and by themselves as quickly as they can. Think!!<br><br>Have armed marshals in the cookie pit that way if the pilot has plans ro take the plane down he can be shot!,0.0,0
Ugwo8oNSPssRPbV9MRl4AaABAg,This was a pilot commiting suicide. That is a vertical dive which is super rare.,0.0,0
UgykZOqlr61M3O6din14AaABAg,made in U.S,1.0,0
UgxOUPOXFtCmS6ys6JN4AaABAg,something wrong with manufacturer...,0.0,0
Ugx7X9K8IewwI8SSHn94AaABAg,suicide，so obvious,1.0,0
Ugwsl3rQ0mE8hHtLHER4AaABAg,&quot;There is no greater love than if somebody gave their soul for their friends&quot; And when would you be giving your soul then Mr Putin? I believe alot of people would be saved if you were to disappear.,0.5,0
UgxvUpmyZXnaIOyEwPd4AaABAg,Adolf Hitler delivered similar speeches to huge crowds of German people during WW2&gt;!  Brainwashing them with propaganda and fear!,1.0,0
Ugxapyhtm_snmxyIk214AaABAg,And My Heart goes out to all the victims and martyrs for more than hundred thousand people died in some countries in the middle east for more than 20 years that have been killed by OUR HERO...... US AND NATO...........,1.0,0
Ugw88px76JYjRd8XrLt4AaABAg,"As a person from Russia , I say : Only you can help clear the brains of Russians , it is necessary to show real news on Russian television, and not Putin &#39;s propaganda , then the masses can stop the war . It is necessary to hack all television channels and other platforms , people have been brainwashed , there are a lot of gullible old grandmothers in Russia who believe Putin . All foreign news is specifically not allowed in Russia , you have to help and change it",1.0,0
UgwNuKxoyag2PA5H3BZ4AaABAg,Bin Laden knelt down to Putin and said &quot;you are my teacher&quot;,1.0,0
UgwUCBjx0jEhkxJt2kB4AaABAg,CNN FAKE NEWS,0.0,1
Ugw-iERI3fzPukpwB9N4AaABAg,"Discriminating  genocide from war in Vietnam and Iraq(Using of  napalm, orange factor),  Nagasaki and Hiroshima (genocide).double standards .Kanpur Massacre 1857,  American-Mexican war (war crimes, massacre ), Nangar Chel  August 16, 2007, 1879 Zulu massacre, Discriminating genocide   from war in Korea and Afghanistan .Destructiwe war in Serbia (operation Allied Force)",0.0,0
Ugx85RKclM52zHZJPtZ4AaABAg,GO AWAY FAKE NEWS,1.0,0
Ugxur2pyyy_qgst4zwx4AaABAg,GOD BLESS RUSSIA 🇷🇺,0.0,0
Ugwb3lUT2yHRDEsJ8oV4AaABAg,"He is quoting John 15:13 to support his actions? Wow…As a Christian, I don’t know what to do with that one.",0.0,0
UgwRINKIUEbcpYAgoSp4AaABAg,"How about 100,000 Iraqi civilians killed by the US:  <a href=""https://youtu.be/9uqpX1QkYFE"">https://youtu.be/9uqpX1QkYFE</a>",0.0,0
UgxizJ-ao2q1RrhoTJN4AaABAg,How is cnn still in business?,1.0,0
UgzCLeLblDRQHqhXV-h4AaABAg,"I can&#39;t believe that Russia Today / RT is banned on YouTube too. They had already banned it on cable TV and TATA SKY. Heights of curbing free speech and imposing anti Russia propoganda. Let people listen to all sides and form their own opinions. The most important question should be: WHO WOULD SANCTION THE USA FOR CREATING UNREST AND CAUSING HUMANITARIAN CRISIS BY BOMBING OR INVADING THE FOLLOWING COUNTRIES? 🤬<br><br>Afghanistan 1998, 2001-<br>Bosnia 1994, 1995<br>Cambodia 1969-70<br>China 1945-46<br>Congo 1964<br>Cuba 1959-1961<br>El Salvador 1980s<br>Korea 1950-53<br>Guatemala 1954, 1960, 1967-69<br>Indonesia 1958Laos 1964-73<br>Grenada 1983<br>Iraq 1991-2000s, 2015-<br>Iran 1987<br>Korea 1950-53<br>Kuwait 1991<br>Lebanon 1983, 1984<br>Libya 1986, 2011-<br>Nicaragua 1980s<br>Pakistan 2003, 2006-Palestine 2010<br>Panama 1989<br>Peru 1965<br>Somalia 1993, 2007-08, 2010-<br>Sudan 1998<br>Syria 2014-<br>Vietnam 1961-73<br>Yemen 2002, 2009-<br>Yugoslavia 1999",1.0,0
UgxoH-OQQQMRas05H014AaABAg,I wonder how many thousands of people he paid to come to this speech!,1.0,0
Ugzi9J7hBSB3s5f3oTZ4AaABAg,"Is Macedonia a country?<br><br><br><br><br><br><br><br><br><br>North Macedonia (Macedonia before February 2019), officially the Republic of North Macedonia, is  in Southeast Europe. It gained independence in 1991 as one of the successor states of Yugoslavia.",0.0,0
UgyJm_oeWx7JHZsdpFd4AaABAg,Is Putin really the bad guy here ??,1.0,0
Ugx2n26JwpDWthy2Gfl4AaABAg,It’s amazing how USA tells China not to assist Russia with weapons in Ukraine war but not the other hand the entire NATO and west is providing firepower to Ukraine.<br>Talk about equality,1.0,0
Ugyf3euf7ORaMgGB2KJ4AaABAg,"Love russia 🇷🇺 !<br>Proud people, greatest biggest and richest (ressources) country",0.3333333333333333,0
UgyAK2Hj_q8BOKNXWJB4AaABAg,My heart is with Ukraine 🇺🇦,1.0,0
UgwAMKtpMLyupuH2T814AaABAg,Nazi hitlers kids,0.0,1
UgztlWd68ZRqkPDmGCR4AaABAg,"Now let me get this straight, Russian civilians are chearing for the death of Ukrainians which are Russians? Yay. How fucking stupid!",1.0,1
UgwEFdPXfRsnD1XAcGZ4AaABAg,Oh Look. It&#39;s Russian Trump.,0.0,1
UgwKqMNAj5D2L0xn5lR4AaABAg,"Please send food, we are starving now.  We have only sugar to eat.",0.0,0
UgwHpzqD8MA8HWtoxBV4AaABAg,"Putin budował sobie pałac i przespał zbrojenie się Ukrainy w latach 2014-2021.Chciał  Ukrainę zaatakować, ale powstrzymał go jego sztab w 2014. Rosja przespała  rewolucję dronową .Porozumienia mińskie uśpiły Putina .Co się może wydarzyć .Rosyjscy wojskowi  mogą zabierać ze sobą ludność cywilną aby chronić  konwoje wojskowe opancerzone wozy ciężarówki oraz  czołgi  które nazwałbym złomem (żywe ludzkie tarcze).Rosjanie będą się okopywać   i  będą 2-3 bombardować miasta   i potem kilka dni przerwy potem znowu będą  bombardować i kilka dni przerwy i tak dalej  wojna potrwa 1,5 roku  a jej krwawe apogeum  nastąpi lipiec-sierpień, wrzesień-październik .Zajmowanie małych miast  a dużych obleganie. Zniszczenie gazociągów linii kanalizacyjnych, wodociągów , oczyszczalni  ścieków, supermarketów, silosów ze zbożem, tam, zakładów produkujących kombajny traktory, zakłady przemysłowe chemiczne elektrochemiczne, energetyczne walcownie, stalownie, huty stocznie porty, sklepy,muzea teatry .Przygotowanie obozów internowania, przesiedlanie ludności  w tym opornych wgłąb Rosji  ,agresywnych będą osądzać  w Rosji. Będą strzelać w nogi w czasie bontów cywilów używać gazu pieprzowego i armatek wodnych. Rosja może użyć broni muzealnej opróżnić  magazyny z bronią zdobyczną niemiecką oraz arsenał radziecki  wyprodukowany w latach 1933-1999.Aby oszukać obronę przeciwlotniczą i antyrakietową  mogą używać starych atrap  bomb  lub bomb przedwojennych np niemiecką broń zdobyczną i radzieckie pocieki z lat 40tych i 50 tych. Radziecka broń np wozy bojowe rakietnice moździerze,działa, armaty, miny, bazuki, pociski bomby strzelby karabiny starsze modele  katiusze (Tornado G  nowsza wersja ) , stara brń  antyraketowa i balistyczna, nośniki rakiet, radzieckie starsze modele samolotów i śmigłowców myśliwców, szybowców, granaty .Ściągną najemników z Afryki, Bliskiego Wschodu, Dalekiego Wschodu,Azji Centralnej,Krajów postsowieckich,Bałkanów Ameryki Lacińskiej, Serbii, Koreii Północnej 60000 ludzi, mogą powołać wszystkich rosyjskich  więźniów z aresztów i obozów karnych  w zamian za amnestię ok 250000-500000 , mniejszości rosyjskie z krajów bałtyckich ,Krymu,Naddniestrza, balkanów i Skandynawii  najemników z Hiszpanii i Francji,Mongolii i krajów postsowieckich. LORA,Kinzhal, Grad,Tornado-G, Orlan 10, Orion combat drones,  izralelskie i azjatyckie drony, MLRS, 9M133 Kornet, ZSU-23-4 Shilka, drony Posejdon, pociski Sarmata,czołgi T Armata, kopiowanie broni zdobycznej lub jej przejmowanie  i uzycie.Rosjanie zrzucą herbicydy  na pola aby nie obrodziły ,broń naplam na lasy  aby wywołać pożary lasów, żeby wykurzyć  Ukraińców, zaminują lasy szczególne od  dróg w głąb lasu   do 5 km . Cywilne drony i samoloty modele mogą  wyposażyć w ładunki wybuchowe. W ostateczności Rosja może użyć mini nukes broń termo baryczną dźwiękowa laserową  fosforową żelazny promień , powietrzno-paliwową, próżniowa,   gazy opioidalne musztardowy  lub sarin lub wąglik przenoszony w pociskach. Kamuflaż czołgów listowiem oraz  unikanie  przez czołgi  autostrad ,przejcie z rozmów analogowych na cyfrowe ,używanie szyfrów, rozpierzchnięcie wojsk po lesie,  na froncie wschodnim  będą bombardować  linie obrony Ukraińców rosyjskie Tornada G i katiusze rakietnice oraz najemnicy z czarnej Afryki i Bliskiego wschodu w tym zrzucenie na armie ukraińskie i okopy  broni fosforowej .Ogłoszenie w Rosji stanu wojennego i uruchomienie fabryk  obowiązek pracy narodu w zakładach zbrojeniowych obowiązek dostarczania dronów cywilnych i innych modeli  latających  aby je dozbroić  wyposażyć w ładunki wybuchowe i uzycie w walce , minowanie miast i okolic, lasów i pół tak może być .Możliwe  uderzenie kosmiczne  rakiet  na satelity szpiegowskie Muska lub eliminacja go przez Chiny i Rosję w przyszłości. Rosja ma legalne umowy handlowe i zbrojeniowe.Oba kraje nie dadzą się zwasalizować   z Chinami a w dobie ekspansji NATO na wschód i AUKUS na Pacyfiku  Chiny i Rosja mogą nie uznać INF i START i zbroić się w sposób nie kontrolowany w samoobronie masowa produkcja głowic nuklearnych. Duże  miasta Rosja może zrównać z ziemią w ostateczności np  zrzuci nagle   15 bomb termobarycznych na Charków, 15 bomb termobarycznych na Mariupol i 25 bomb termobarycznych  na Kijów lub na armie urakińskie na froncie wojennym lub broń fosforową. Działa ukraińskie i armaty  między budynkami, broń zakopana w lasach lub w ziemi lub  umieszczona  w mieszkaniach cywilnych i piwnicach.Cel Rosji : odciąć Ukrainę od MOrza Azowskiego iCzarnego , zniszczyć flotę   ukraińską oraz nieustanie  punktowo niszczyć  konwoje z najemnikami  zachodnimi  i zachodnią śmiercionośną bronią przybywające  nieustannie z zachodniej.Jeżeli Rosja (flota) i Bialoruś  będą ostrzeliwać ten obszar i niszczyć punktowo  konwoje dla Ukrainy to wygra.Piętą achillesową Ukrainy jest Zachodnia granica granica polsko ukraińska .Mogą zrzucić pociski z  gazem usypiającym lub drażniącym",1.0,0
UgznYWwv0ap1XQAN9ol4AaABAg,Putin is a war criminal. <br><br>Putin is a killer. <br><br>Putin is a kleptokrat and a diktator. Vladimir Putin is robbing the Russian People every Day. Vladimir Putin will be president until   2 0 7 8. <br>Vladimir Putin is a corruption presiden. <br>Russia is not a democratic country and have never been a democratic country. Vladimir Putin is one of the richest persons in the world. Vladimir Putin is a war criminal. Russia is not a democratic country and have never been a democratic country. Russia needs something better than this Vladimir Putin. Russia has no democratic tradisjonsjons. Russia needs strong democratic insttutions. Human rights in Russia now. Let us pray for Aleksander Navalny. Let us pray for Ukraina.,1.0,1
UgxcZQP4hVmyd0jHMBF4AaABAg,Putin vs the NWO of corporate gangsters,0.0,0
UgxKFn1y3pu9GG1R0ah4AaABAg,"Putin wearing a winter hat can be seen from 1.00 to 1.03 in this video and he&#39;s younger in this sequence.  Most of the images, apart from Putin&#39;s speech, are from the celebration of the annexation 8 years ago. Everyone who looks at this video should understand that the mood and spirit in Moscow today is not like it was 8 years ago. No such event could attract an audience of 100.000 in the stadium and just as many outside. Putin speaks to a smaller crowd of people, but the huge crowd is from the Crimea celebration 8 years ago.",0.0,0
UgxnH_NmyYakip48CFl4AaABAg,"Putin&#39;s jacket in that speech looks like an import from Europe; a chic luxury jacket worth almost 12,000 Euros from Loro Piana in Italy. Ironic, isn&#39;t it? A tailor sees everything, Mr. Putin. :-)",0.0,0
Ugya9GAaFvrVkV3YEjd4AaABAg,"Putin,You poor deluded fool.<br>You&#39;re nothing but a uncivilized war maniac who still wants to play human chess like a baby.",0.875,1
UgxWSk0hvOxktok1qeR4AaABAg,The Mad Czar a  danger to all mankind,1.0,0
UgwziDpZ0kDHsQrUBAB4AaABAg,"The best President Vladimir Vladimirovich Putin❤❤❤❤❤God bless you🙏 I am proud of you💪✊✊Glory to Russia,🤍💙❤ Glory to our veterans🙏❤Glory to our heroes, our defenders❤                      Fascism must be destroyed so that there is no shame in front of grandfathers.",0.0,0
Ugy_0ZwylNbMiVcr1jR4AaABAg,They got a Muslim woman lying live on CNN? It&#39;s forbidden in Islam to lie.,1.0,0
Ugx5d5rTOlpIbgKkwvJ4AaABAg,"What gives you the right to say &quot;Russian propaganda machine&quot; when I could say the same about you peddling the &quot;Western propaganda machine funded and fuelled by the USA&quot; when I see Russia Today and many Russian voices banned on YouTube!! I can&#39;t believe that Russia Today / RT is banned on YouTube too. They had already banned it on cable TV and TATA SKY. Heights of curbing free speech and imposing anti Russia propoganda. Let people listen to all sides and form their own opinions. The most important question should be: WHO WOULD SANCTION THE USA FOR CREATING UNREST AND CAUSING HUMANITARIAN CRISIS BY BOMBING OR INVADING THE FOLLOWING COUNTRIES? 🤬<br><br>Afghanistan 1998, 2001-<br>Bosnia 1994, 1995<br>Cambodia 1969-70<br>China 1945-46<br>Congo 1964<br>Cuba 1959-1961<br>El Salvador 1980s<br>Korea 1950-53<br>Guatemala 1954, 1960, 1967-69<br>Indonesia 1958Laos 1964-73<br>Grenada 1983<br>Iraq 1991-2000s, 2015-<br>Iran 1987<br>Korea 1950-53<br>Kuwait 1991<br>Lebanon 1983, 1984<br>Libya 1986, 2011-<br>Nicaragua 1980s<br>Pakistan 2003, 2006-Palestine 2010<br>Panama 1989<br>Peru 1965<br>Somalia 1993, 2007-08, 2010-<br>Sudan 1998<br>Syria 2014-<br>Vietnam 1961-73<br>Yemen 2002, 2009-<br>Yugoslavia 1999",1.0,1
Ugz_503V1VKb28Llnwp4AaABAg,"When it comes to the world of investing,most people don&#39;t know where to start. Fortunately, great investors of the past and present can provide us with guidance",0.038461538461538464,0
UgwCeBAaqcsV6Y124Xd4AaABAg,Wow what a great crowd of Russian patriots showing their love for country and giving their support to Vladimir Putin .,0.4,1
Ugxuyz5lCMMpFLzvl7l4AaABAg,"Yes true,<br>But where is that Canadian sniper when you need him.",1.0,0
UgzCc0jqZoxv6XwBlv94AaABAg,Z stands only for poZor. The biggest disgrace on Earth since naZi Germany - this is modern Russia.,1.0,1
UgzlU5ncf4u1_dTJjgx4AaABAg,"first of all, people are together, because they want to show the whole world that they are together and love their country in spite of any difficulties. 🇷🇺 Yes, that&#39;s how people can support each other when they know their country is having a hard time.🇷🇺  If people have a mind, they will understand it.🙏❤❤🇷🇺❤❤❤",1.0,0
UgyJIr0e13_rrUd-Cmx4AaABAg,"if it was any western president he would have given that speech behind bulletproof glass.....Putin has guts, thats why his people love him.",0.0,1
UgxXSSiXAWdgsfTD_lt4AaABAg,"people just show their unity.  🇷🇺❤and yes, it seems that all people except Russia ended up in their own information bubble.⚪🤓 And now they saw the Russian people and you don’t believe your eyes.🤓🇷🇺❤😂💪💪",0.0,0
UgwvcOPz1HwUq2BfrM14AaABAg,"people just show unity. 🇷🇺 and yes, it seems that all people except Russia ended up in their own information bubble. ⚪🤓 And now you saw the Russian people🇷🇺 and you don’t believe your eyes.🤓👍🏼😳🇷🇺🙏❤❤❤",0.0,0
Ugzq5sbzzS1kEoXcs1x4AaABAg,people who understand how the world works are for Putin the others are sheep that follow Biden and Cabal these are often also the people who have been factinated with rna COVID,1.0,1
UgyNYdgSXgX-A8g0oXt4AaABAg,russian propaganda working at their best in Russia,1.0,0
UgwwQQbEsg6e_JydZCp4AaABAg,shut up about ukraine. this is a fucking russian celebration for THE INNOCENTS,1.0,1
UgxtverN21ZRX37c5kx4AaABAg,so they cheering for murdered &amp; destroyed ukraine ?,1.0,0
Ugy6Tol9CemvMNfT7wp4AaABAg,"&quot;Cleansing&quot; heh, this doesn&#39;t sound like Stalin, this sounds like Hitler level of crazy...",0.5,0
Ugy0HtT-t4anbzvxWjd4AaABAg,"A big part of the problem between western and Russian relations is that neither one of us, get the true information from the other country. I was watching a YouTube or from Russia today and someone commented that they have been more educated in five days from a Russian YouTube or than they ever were in school or by the media in the United States on what is really going on in Russia. You guys refuse to cover anything that is going on over there and you don’t give the other perspective any coverage. That’s really frustrating to me. Cover both sides of the story and let me make my own opinion. I already have made my own opinion because CNN is certainly not my only source of news.",0.0,0
Ugx4nhOpYmKhW7h9kQV4AaABAg,ANY ONE WHO HURTS CHILDREN IS A PIECE OF CRAP.GOD IS GOING TO GET THIS GUY .AND IT MIGHT NOT HAPPENED THIS SECOUND.BUT TRUST IT WILL HAPPEND .SAYS IN BIBLE IF YOU HURT CHILDREN YOUR BETTER OF TIEING A ROCK AROUND YOUR WASTE AND THROW YOURSELF IN DEEP OCEAN.i think,0.0,1
Ugw7jdxaFsA0YtKacVt4AaABAg,"Hello sofa experts. The reality is that Zelensky is a Nazi, on his orders children and old people were killed in Donbass for 8 years. Even now, Ukraine is shooting at civilians with all its artillery weapons. Fleeing from the Russian army, they leave scorched earth behind and destroy civilian infrastructure. Ordinary people have serious humanitarian problems. Every day there are hundreds of tons of food coming from Russia for Ukrainian citizens liberated from the Nazi Zelensky regime. Endless provocations to blame the Russian army. Russia cleanses this world of bastards.",0.0,1
UgwA5BZwXSyg1sHsKjp4AaABAg,Man does this sound anything like someone from 1939 .. 😖 I hope his generals take him out and soon.. cuz they gotta know we can&#39;t have a new age mix of Hitler and Stalin in the world,1.0,0
UgzRo83sFh3mb8Bq2Mp4AaABAg,"Re: Putin&#39;s motives. He knows that he can never defeat the West. But the closest he could come to defeating the West is to have a nuclear war, one that will destroy most of the West, and most of the East, but he just might survive, and be hailed as the champion or Russia. Further, even if he didn&#39;t survive, he considers he will go down in history as the champion of Russia. This IS his off-ramp. At his age, after his years of struggle as a leader, a nuclear war serves as his swan song, and he is singing it to himself as the West tries to figure out what he is &quot;thinking.&quot; This motive makes sanctions, loss of popular appeal,  bombing of hospitals and schools and humanitarian routes irrelevant to Putin, since the final result makes all of those just unimportant, if not moot points along the way to the massive destruction contemplated, accepted, and/or even hoped for. This ugly motive is of course deniable, but I say it is his  intention, and that he is perfectly willing to risk it all in order to have this big &quot;win&quot; as part of his legacy. Calling him crazy or evil won&#39;t work, because he knows it&#39;s crazy and evil. But it is his SOLUTION!!  NATO, and the rest of world leaders should acknowledge this,  brainstorm it, and  prepare accordingl",0.0,1
UgwoyN4u6KRq8isDdyB4AaABAg,"Stolen elections have consequences. A historic, record breaking 83,000,000 people would agree! Lol",0.5,0
UgyNcZ81-faboyJ597F4AaABAg,Take out putin,0.0,0
Ugy4MD2V64Fi65IFU5d4AaABAg,"Ukraine gov. was dropping bombs in Donbas for 10 days, killed thousands of its own citizens, Russia invaded and saved everyone in the area, f**k Zelinsky and f**k everyone who “stands with Ukraine” your standing with globalist money hungry bankers who are actually destroying Ukraine, I’m Ukrainian and everyone I know there hates the Ukraine government and prayed for help from Russia",1.0,1
UgwZCMaarIqRKtwvvYh4AaABAg,"Vladimir Putin has so much blood on his hands at this point... If he uses weapons of mass destruction like chemical attack or FOAB vacuum bombs, I want America to unleash their F-35 fleet and do a massive air campaign against the heavy artillery around the major Ukrainian cities that regularly kill civilians. The man is a schoolyard bully and will certainly not start WW3, because he enjoys his luxurious lifestyle running Russia far too much. And at heart he is a coward. We can all safely assume he will never visit his troops on the Ukrainian frontline! Lol ; ); )",0.0,1
UgyKjO91DNJK72Apgbl4AaABAg,stop eating and drinking Nestle products they support Putins war....,1.0,0
UgziDdaWdT4VFro7OXN4AaABAg,"<b>CNN actually writes:</b>  &quot;Two people were transported to a hospital after a helicopter crashed into the ocean near the Miami Beach shore, according to a <b>tweet</b> by Miami Beach Police.&quot;<br><br>They are literally using a TWEET from TWITTER as a reference/source for a story. Not the actual police department, but a TWEET they sent.<br><br><b>ROFL!! This explains EVERYTHING you need to know when it comes to if CNN can be a trusted &quot;news&quot; outlet.</b>",0.0,0
UgzvZdk0CG2_3HCB7KB4AaABAg,"<b>Everything reeks inflation in the  economy.... I don&#39;t know who, however a person desires to pay attention to this, you have to stop relying on the government and saving all of your money . Venture into making an investment a few in case you actually want monetary freedom</b>",0.0,0
UgzkDLacpA8oLyftjc94AaABAg,All pilots are taught auto-gyration in case of engine failure.<br>Failure too auto-gyrate you don&#39;t get licenced to fly.,0.4,0
UgwaSMHjsKKw0ouro0V4AaABAg,"Also CNN: &quot;Swimming is racist, tune in at 6 to find out how.&quot;",1.0,0
Ugy--yRI5nBEW1HbyFp4AaABAg,"As a pilot myself that flies up-and-down the same beach line every week doing sightseeing tours, this hits close to home for me.",0.0,0
Ugw9_z0yyYKjEt4ucW14AaABAg,"As interesting as this is, are you ABSOLUTELY sure there are NO OTHER stories that need to be touched on?",1.0,0
UgyhOkRqF_1P0Z4mDX14AaABAg,"Because of economic crisis and the rate of unemployment, now is the best time to invest and make  money💯",0.0,0
Ugx3s68bnbTuS5ukVNN4AaABAg,"Because of economic crisis and the rate of unemployment, now is the best time to invest and make  money💯..",0.0,0
UgwL7XZmMaw9oWxQ1B94AaABAg,CNN NEEDS TO BE CANCELED,1.0,1
Ugyqbr4n1_9kikz8Q5J4AaABAg,CNN NEWS IS CORRUPT.,1.0,1
