commentID,comment_text,hate_instigation_level,hatespeech_or_not
UgzOiEBZihHzFS-7BRN4AaABAg,Fighting 7.5% inflation (more like 15%) with a 1% fed funds  interest rate is like stopping a Forest fire with a bucket of water. Folks prepare accordingly. Make investment in other not to depend on the government for funds,0.14285714285714285,0
Ugw8At8BDhcIZgL-GV54AaABAg,"I think Putin wants to use Ukraine as a staging area for a possible conflict with NATO. From Ukraine, he could launch strikes against Poland, Romania, Hungary and Slovakia.",0.0,0
Ugx8uWB2I8Kfet2FHiB4AaABAg,I wish I would get a dollar for every time CNN said Russia in The last 5 years.,1.0,0
Ugy5l5RpLLhtLyTKAaF4AaABAg,If the Ukraine wants the protections of NATO they need to become a member of NATO why have they not asked for admission?,0.0,0
UgzE-3J2LZ7Os1J2jIV4AaABAg,"If you want to say - War, It&#39;s best to look your child in the eyes first! 💓",0.0,0
UgyCfKLTp99gM498ViF4AaABAg,"In fact, one simple thing breaks all speculation and lies.
<br>Thousands of refugees flee the conflict zone to Russia. You can easily find these videos. Fill in the words, Ukraine, Refugees, Ukrainian refugee camps.
<br>Tens of thousands of refugees, dozens of camps. The entire European part is in camps.  Can you imagine how many videos there are?
<br>Now think, Russia attacked Ukraine.
<br>How does it fit? and why refugees do not flee to the west of Ukraine, but flee to Russia.
<br>Basically everything there is to talk about.
<br>Lies, the media lies. Who needs it and everyone knows.
<br>It is obvious that it is necessary to end the civil war in Ukraine, but this is not beneficial to the organizers.
<br>Ukrainians have been killing Ukrainians for 8 years. Do you think NATO does not know this?
<br>You can easily find this information, but they do not know?
<br>Everyone knows everything, they just don&#39;t tell you. We need an enemy, we need an evil Russia, and a poor new democracy. and let Ukrainians kill Ukrainians, let them have Nazis, open Nazis, the same Azov battalion, even on Wikipedia. But these are our Nazis and our democracy, they are against Russia, and the fact that Ukraine is dying does not matter.
<br>For some reason, only Russia cares about the lives of Ukrainians.
<br>Refugees talk about the conflict more than a thousand politicians, experts and congressional fortune-tellers.
<br>Who wants to hear them will hear.
<br>I won&#39;t post videos. Because they will say that I specially collected them. Look for yourself, you need to believe in yourself.",0.0,0
UgyIU_qBEWG-geENbSJ4AaABAg,Joe is making sure that the missionary position is now the position of the United States.,0.0,0
Ugxqj-zYbdZEhLG0Uf54AaABAg,Let there be peace in our times.,0.25,0
Ugw94EiEDVHoYMoPz8R4AaABAg,Macron also said there would be no more Russian aggression. This guys needs to shut up and sit down.,0.0,1
Ugy9bSMLW58ZNja0ne14AaABAg,Macron is full of it,0.0,0
Ugww54tjneWoHuk5sIZ4AaABAg,Makes you think why Trump and Putin  was so close. 🤔 🧐,0.0,0
UgzVvEkBGYlReGn79pJ4AaABAg,"NATO must respond by unilaterally declaring Ukraine a full NATO member. It is the only way to stop this ego driven dictator. Period. Germany and Russia started WW2 by invading Poland so Germany must be the one to step up and protect Ukraine now with full military support as historic reparation for their previous 1939 actions. This is a just cause for it is not ok to murder people to take their shit. It is time for the free world to shut off, and shut out the countries of Russia, China, Iran, Syria, and North Korea. No Trade, no travel, no flights, nothing. Close all borders, and shut them in together so they will tear each other apart.",1.0,1
UgznFXWvVqf6oN2ffLF4AaABAg,People are dying in Ukraine.  Where  is NATO and the West to help Ukraine militarily?? My heart cries for the people of Ukraine. 🙏🏻🇺🇦😭,0.0,0
Ugyn0QdyuoWGnRM7cGt4AaABAg,People like him need to get their Karma on the world stage.,1.0,0
Ugw_1wEpCDK6TBoXMm14AaABAg,Putin just signed the  recognition of two sovereign states within Ukraines borders. and declared he wiil take action immediately,0.65,0
UgyfTnMVkmuhUko6GMl4AaABAg,Questions: <br>1) Should you leave your enemy come at your doorstep!?<br>2) Should you allow your enemy grow in strength or effluence!?<br><br>This war for me is inevitable.,0.3333333333333333,0
UgwXUqlpgCQGKpK17yh4AaABAg,Revenge on Russia! The US government is considering selling US oil at half the price of Russian oil!,0.0,0
UgwX5jZ1iQpc-zqsKjp4AaABAg,Russia has already taken Ukraine.  These meetings are a stall to put all his people in strategic positions.,0.3333333333333333,0
UgxVep7Kk5Gr_YVHfPF4AaABAg,"Russian frigate strikes US submarine.<a href=""https://youtu.be/B1hE6YZqyiM"">https://youtu.be/B1hE6YZqyiM</a>",0.0,0
Ugw9n62jWTtA81591jR4AaABAg,Sounds like Hunters paintings aren’t selling. The big guy needs to protect his business interests.,1.0,0
UgwMtxFUVmlSqYwOui94AaABAg,The philosophy of the rich and the poor is this: the rich invest their money and spend what is left. The poor spend their money and invest what is left.”,0.0,0
UgzSIKohQnqf3uNJBWB4AaABAg,This is what happens when you have a leader that can&#39;t put two sentences together. Of course we have the great Obama running the country from the basement of the White House,0.3333333333333333,0
UgxY8_zf_18MmiMTfNV4AaABAg,"To have a recommended constitution that is made to accept  reports of all sort whether technological or  practical to ensure diplomacy and  retreat,  be the complaining solving the problem . But neverthemore of the constitution is reform then what is it and when best edition  publishing establish  reform or producing a constitution  here and now ; what would become of the existing constitution authority wordy-ness service exposure convention maintenance  accelleration afterwards of all the sponsorship .",0.5,0
UgwCpN7K3j8fap9EbWt4AaABAg,"Warning, Putin bots in this comments section!",1.0,1
UgytN8y2Sm24XjUnXo14AaABAg,"Well, if Ukraine is not going to be part of NATO, then why are the Ukrainians being given military grade weapons, supplies etc...<br><br>Military Industrial Complex???",1.0,0
UgwFlCq_wrABFQDdK1h4AaABAg,What was so difficult about responding to the Russian request for peace terms.,0.0,0
UgyIl5wolt8yCd-Df2Z4AaABAg,When the elephants are fighting the grass is trampled. - African aphorism,1.0,0
UgxZ9vCU-NEDI-QWvxJ4AaABAg,"Yeah, let&#39;s impose economic sanctions on them. Like the illegal embargo on Cuba, condemned 28 times by the United Nations General Assembly. This is the best way we know to approach conflicts of interest: either they do what is good for us or we punish them... But the day we have no strength to punish them is round the corner, so hold on!",0.0,0
Ugyyhr4EsImsPsO3Owl4AaABAg,admit Ukraine to NATO immediately.<br>don&#39;t  let this clown with an army get his way<br>it will never stop,1.0,1
UgzygR_1nk0sAXfI9dB4AaABAg,"difference between &quot;looking dangerous&quot; and &quot;being dangerous&quot;.Russia <br>describes military doctrine as defensive military doctrine. With regard <br>to nuclear weapons specifically, Russia reserves the right to use <br>nuclear weapons: in response to the use of nuclear and other types of <br>weapons of mass destruction against it or its allies,in case of <br>aggression against Russia with the use of conventional weapons when the <br>very existence of the state is threatened.<br><br><br>oops<br><br><br>google russia deadhand <br>The &#39;Perimeter&#39; system, dubbed in the United States and Europe the &#39;Dead<br> Hand&#39;, is an automatic control system for a retaliation nuclear strike.<br> To put it simply, if Russia&#39;s territory is devastated after a nuclear <br>attack, the Perimeter system automatically strikes the enemy&#39;s territory<br> with its own nuclear missiles",0.0,0
Ugy_wK79r7E3GIMm1E54AaABAg,“And the Poles are getting downright arrogant in Danzig…”,1.0,0
UgzkAIN3wjPTNMspBf14AaABAg,All he&#39;s doing is trying to stay employed. This whole situation makes it very clear who prioritizes self interests over country.,0.0,0
UgzqLqJxXw9rIKEgsZh4AaABAg,Coming This Spring..2000 MULES..GAME OVER!...FJB,0.0,0
Ugx39X9Zz2M2y5E16MV4AaABAg,Great context.everyone needs more than there salary to be financially stable.the best thing to do with your money is to invest it rightly.because money left for saving always end up used with no returns.i started investing in Bitcoin mid November 2020 with the help of a well-known- professional Mr Jeff Johnson manure and the profit entirely Business only 🇱🇷,0.0,0
Ugw7N5Poz4OGLpDX3eh4AaABAg,Happy Presidents day to all: except disgraced #45,0.0,0
UgxOMChHdlVpyUBHuxJ4AaABAg,More news about Trump than Biden. I guess Biden only produces crisis that CNN must hide away.,0.0,1
UgzQmxid2mOxYn8wjT54AaABAg,"My God, Trump isn&#39;t President, Sniffy Joe is.  You&#39;re ratings are in the toilet, try I don&#39;t know, actually reporting news.  Like, out of control inflation, Canada, Joe Rogan has more viewers.",0.0,0
UgyptKcWjcERqcblSBh4AaABAg,No Senator Scott. Not “Everyone “ wants to be on trump’s band wagon. Believe me.,0.0,0
Ugxb-nmEtVpI3WRGGyN4AaABAg,President Donald J. Trump is the best president this country has ever had!,0.0,0
Ugz5ZFYSTmoH4aIl5QF4AaABAg,So while crisis come&#39;s up .Bitcoin climbs lol 😆 Now i say crypto is better than stock investing in crypto should be in every wise individual to do list .,0.0,0
UgxBjwDcoTBloPY59pJ4AaABAg,TRUMP 2024 ...BITCH,1.0,1
UgwV4nSIU7EkAMPjD6J4AaABAg,The Republican party is not putting Americans first. The only thing they care about is keeping their lazy asses in office.,0.0,1
UgzZvmgcuf0jwm-Cn5x4AaABAg,"They really need to grow a pair &amp; just accept that he&#39;s a twice impeached, one-term loser. <br><br>Find a new GOP voice FFS.",0.5,0
Ugych9uFgxHjkEztIh54AaABAg,"Tim Scott is the third black person in the last 140 yrs to stand as a republican US senator, he is also arguably only the 2nd black person in world history to stand as US senator and actually defend conservative values. 🤢🤮 There are reasons why black people generally refuse to vote republican, Amistad deck-hand Tim loves to ignore those reasons and take the cash for himself.",0.0,0
UgxYsoO2NhldF-Qb2cZ4AaABAg,"Why is everybody talking about Trump running again? You all know he won’t because he is a criminal and it will be proven and judged long before the 2024 elections. If he’ll ever go to prison is not sure, but he sure won’t be allowed to be in any government office.",0.0,1
UgxYzHQ2qolLUw18Ipp4AaABAg,trump 2024!!!!!!!!!!!!!!!,0.5,0
UgwVHDfFE28Ez19Oxit4AaABAg,Damn. Don Lemon is looking OOOOOOOOOLD,0.0,0
UgwTeLxxnzuaIFkZUHx4AaABAg,"How can Putin<br>murder all of these Ukrainian children &amp; defenseless hospital patients, schools &amp; churches &amp; homes &amp; not be an evil demented monster? Every time his name is mentioned it should be followed by: THE EVIL MONSTER!!!! HE NEEDS TO BE ARRESTED &amp; PUT ON TRIAL FOR HIS ATROCITIES!",1.0,1
UgxbDt8QP86qHhOGAr94AaABAg,How sad. People starving and these people are living high on the hog. But they can&#39;t take it with him.😣😣😣😖😖,1.0,0
UgzmB-LQLT4celZRE-x4AaABAg,"I came to learn how to invest after listening to a guy on radio talk about the importance of investing and how he made $460, 000 in 4 months from $160k, some how this video has helped.",0.0,0
UgwWk9QaoHYN3gVZVGZ4AaABAg,Putin sounds like a Russian Donnie tRump...operating with impunity.,0.0,1
UgxTYXqo47dvQiAKtn94AaABAg,Send a spy drone and see if he is there. If they confirm that he is there then bomb it until there is nothing left standing and a huge crater in the ground. Then Russia can pull out of Ukraine.,0.0,0
UgwWc6Og3flF5MLh3ZB4AaABAg,"Trump tried the same crap here, I kinda wished trump had confiscated the voting machines him being killed by the American people would have sent a very clear message to the world how the USA deals with dictators. To the next trump make no mistake if you think your illegally taking my right to vote. &quot;Today is a good day for you to die.&quot; The American people would have already killed Putin.",0.0,1
Ugy1F7RbQ_Vv3Rn0jTR4AaABAg,"Vlady Putin, America will bury you!!",0.0,0
UgwlEML-RGSpSGJzNdR4AaABAg,"Well. Just remember: the REASON why we cannot get at the rich Russians is because rich people in the West do not want laws that make it possible to trace money effectively. The EU has suggested to introduce such laws, but the US does not accept these laws because... well, in the US money is power...",0.0,0
UgwwVSnaqlOY7ch7rzJ4AaABAg,Whats the church for?  He doesn&#39;t actually go in it ...does he?  To do what ... pray for forgiveness for all his murdering!!,0.0,0
UgzzXcWxMPdSVyPV25Z4AaABAg,"all news form west media ... Hoax, fake, .. fabricated",1.0,1
UgzLEDnS1sDNxx6v51h4AaABAg,CNN selling fear by the bushel,0.0,0
UgxyanRQdeV_f31E_7h4AaABAg,Change the rules so Elon Musk can be president. We need someone super smart and innovative. Someone who knows how to delegate responsibilities to the right people. A catalyst with good judgement so the US can get things done.,0.0,0
UgwRJEa2cHSh0rOQR-x4AaABAg,"For those who are especially concerned, I will explain. The Russians attacked only the administrative buildings where the resisting Ukrainian soldiers were sitting. The power units were not attacked. Do you think they are idiots?
<br>Secondly, in order to damage the power unit with the VVER-1000 reactor, one must try very hard. They were designed to withstand a direct plane crash. Even if the tank fired, it would not do anything.",0.5714285714285714,1
UgwBptGJJu2O0IzbfdV4AaABAg,I don’t know if people realize but if that nuclear power-plant Went critical it would be 10 times worse than Chernobyl and it’s right beside a river which goes right into the ocean it would completely destroy our entire ecosystem and could cause billions of deaths whoever orders the attack on that Power-plant needs to be disappeared,1.0,0
UgzVjNmfVpZ4tGGqnjN4AaABAg,I never thought I’d ever say this.  But - Lindsey Graham is right.,0.5,0
UgyZ5xFkZl1jxnoBTQR4AaABAg,"I was in Germany during Chernobyl blowout and was told by the US government that there was no impact to us.  No health concerns.   Now if this plant is damaged, the world ends.   Guys get your story straight.   No impact or the world ends?",0.0,0
UgxTnzPAp-n7gz3yHH94AaABAg,"I&#39;m really happy for today 😉😉. I finally got my profit of  $330,000 on my crypto investment after feeling so escatic and heavy minded that nothing good can come out of it...a big thanks to Dmitry Goldin . I learned a lot about buying when there is fear in the market . I use to get shaken out and panic sell but now I buy more when I see the low prices.",0.0,0
UgxBNuy7c3xbaw75-bd4AaABAg,If a nuclear facility can be hazardous to the whole world then I struggle to understand why we build them.,0.0,0
Ugw2UV2xJrVda8GoeKR4AaABAg,Im part Russian and absolutely disappointed in this whole war!,1.0,0
UgxkqUFhlqqFZf3T-pF4AaABAg,Incredible they didn&#39;t know shooting at a nuclear power station is a bad thing. 🤔,0.0,0
UgwE0J8xcdS0K1JOfUJ4AaABAg,"Is president Trump ok, I have not seen him in the news for a couple days. FJB",0.0,0
UgzbHEAjBLPAAbP8MPR4AaABAg,"It doesn’t endanger the entire world, just Europe.",0.0,0
UgzNge5ajLkdNrBNWLt4AaABAg,Lies lies lies...they didn&#39;t attack the nuclear plant they attacked the admin building and gas prices shot up 11 c you bastards should stop spreading fear,0.0,0
UgwobToEU8t_ON7cM0V4AaABAg,"Military forces can&#39;t prevent war. Only friendly relation between states  can prevent war. So, Europe should establish strong and  friendly ties with both Russia and China instead of depending on NATO to  bring peace and stability in Europe",1.0,0
UgwXd12FkR91eUyxm2t4AaABAg,Oh my God...is anyone else having flashes of &quot;The China Syndrome&quot;? That was just a movie but this is real life. Chilling.,0.0,0
UgxgPCPt_PN4oglrCtp4AaABAg,"Only a mad man would order his troops to fire at a nuclear plant. Just absolutely insane - the fact they did, and Putin himself.<br><br>Clearly he has little regard for human life - whether this is innocent Ukrainian civilians (including children), or even his own troops who would have died instantly had one of the reactors exploded. <br><br>This man is already on a par with Assad, and it won&#39;t be long before he&#39;ll be mentioned in the same breath as Stalin, and Hitler. <br><br>Russia today is like Germany in the late 1930&#39;s. The propaganda going on now in Russia is off the scale. It&#39;s worse now than during the Soviet cold war heights of the 1960&#39;s and 70&#39;s. <br><br>I imagine the exact same level of propaganda now going on in Russia, existed in 1930&#39;s Germany, and Stalin&#39;s Soviet Union.",1.0,0
Ugx-iQg2M6RcrBK3VCZ4AaABAg,Putin likely saw that video and was like &quot;WTF!??!?!? WTF ARE YOU DOING!!!! THATS NOT WHAT I SAID!!!!&quot;,0.0,1
UgxDuw85TJ0go1nIKlh4AaABAg,Sometimes it&#39;s better to surrender n save people&#39;s lives and the land.....Ukraine should have respect for their elders Russia <br><br>My point is if Ukraine surrenders many lives and years will be saved...Thank you,0.0,0
UgykFrs9aPNZMYKN1ON4AaABAg,"TO ALL THE IDIOTS HERE...IT WAS PROVEN THE NUCLEAR PLANT WAS NEVER SHOT IT WAS A BUILDING 2,000 METERS AWAY FULL OF UKRANIAN SOLDIERS .... DONT BE BRAINWASHED BY THE LIES OF THE MAIN STREAM MEDIA",1.0,1
UgyTn4pZJ7zF_09r1zF4AaABAg,That’s one sentence I never thought I would hear –“Stop shooting at the nuclear hazardous facility“ 😬😱😳🤬😤😫 I suppose another one would be “you’re endangering the security of the entire world”,0.14285714285714285,0
UgyA3DGIkrB_g2RG7B14AaABAg,"The Russian military captured the plant without a fight. But then they were attacked by a group of Ukrainian saboteurs. The saboteurs opened fire from an administrative building outside the plant&#39;s territory. Return fire was opened on this building. As a result, the saboteurs set fire to the building and retreated.",0.0,1
UgxTITWccSPenxGyi3h4AaABAg,"The fact that the staff is still there just means what an important facility it is, and kinda reckless for the Russians to bomb it.",0.0,0
UgyE2UcMvmKE5nFtICJ4AaABAg,The fact they want to seize a nuclear plant is beyond disturbing,0.0,0
Ugw-4cnlg0jp8jZhL-N4AaABAg,The guy who ordered the attack must be one of the worlds most ignorant and stupid persons on this earth. I hope he gets a long prison sentence when he gets home to Russia.,0.0,1
Ugx4yeN1gKFH53_jp_54AaABAg,"The power plant in question has different design than Chernobyl.  They use light water instead of graphite as the moderator.  An explosion would cause release of radioactive contamination but the affected radius would be much smaller than in Chernobyl. As for how long would the contamination last - same as in Chernobyl, 20 000 years.",0.0,0
UgxPYVber9W7Hy7WaMB4AaABAg,"There is a certain kind of stupidity in those soldiers, isn&#39;t there? I mean, for their own security at least, you&#39;d think they&#39;d know better.",0.13333333333333333,1
Ugymlubhb81O8eKiE4B4AaABAg,They could hold the plant hostage if they really wanted to and shut off power for a lot of Ukraine. I imagine this hurting Ukraine badly.,0.0,0
Ugy_aUXqe30BNJveMwR4AaABAg,"They never shelled the reactor. That was fake news, or as my cat says, fake mews.",0.0,1
UgxPiYykRhwIpKPRygR4AaABAg,This should be a reason enough for NATO to interfere,0.75,0
UgzlAXX7bQyq7ymmSNd4AaABAg,"Total insanity wanting to become a NATO member country.  What a fkkin puppet endangering innocent Ukrainians and still at it wanting to start a nuclear war. And all those fkkers supporting this insane comedian/actor or whatever his fkkin profession is, are war mongers",0.0,1
UgzA85Acqm0TdUMPCHB4AaABAg,USA killed more people within the 21st century than any other country.,0.0,0
UgxurN-7H1zw1esPSPZ4AaABAg,Waoooooooooooo. This was deep . The guy on the speaker had to talk sense to them . GOD bless him .,0.0,0
UgydOZ6SvCf1lWoe2qR4AaABAg,Was the announcement for the show? Or to the Russian invasion troops? I wonder if the troops can event hear the announcement!?,0.0,0
UgwTxgcVuhA3uR1ifZR4AaABAg,"When I heard this was happening and thought it&#39;d turn into Chernobyl, I thought that Putin doesn&#39;t care about anything anymore and there will be a nuclear war. The fact that the fires were put out gives me hope, but that may be short lived.",0.0,0
UgyGDEyCRBRDbj9ErXV4AaABAg,When humanity goes off the deep end -“Stop shooting at a nuclear hazardous facility.”,1.0,0
UgwH8iAZhSDefe67Go54AaABAg,You got to hand it to Putin putting thugs in to overrun a nuclear facility.. dam lunatic !,1.0,1
Ugyj6m71jFlpbdNSJit4AaABAg,"You know Russians didn’t shoot the nuclear reactor, so they aren’t that crazy.",1.0,0
UgzxLWN-HWJyS3TXDKV4AaABAg,America Wake up to globalist Liberalism !!,1.0,0
Ugz-xrTX7ojNDEJ0ofB4AaABAg,"I am curious what would happen if NATO, with the UN backing, organized and pushed a rapid peacekeeping force into Ukraine? Rush NATO forces into Ukraine to seize any areas that the Russian forces have yet to occupy. After all, the Russian operation has been labeled as a peacekeeping force. It is not a declaration of war, but more of a stare down. Such a move would at least minimize casualties and the refugee crisis. I know it could backfire because it may give Putin another reason not to back down, but I am afraid without any intervention there could be 10-20 million refugees dislocated for years to come.",1.0,0
UgzBuEuFmXikJjcZGcB4AaABAg,"Rusia sacrifice million to free us from nazi horror. Rusia is a dragon with thousands heads , if you push to hard they will open their mouths and everything and everyone will turn to ashes. “PLEASE STOP”  you are misunderstanding Rusia. They are giving us time to be reasonable.",0.0,0
Ugz1cIBckrfJOT29xWR4AaABAg,"Ukraine officials are abusing blacks and Asians fleeing Ukraine.  <a href=""https://youtu.be/d5Ufs9_O5ik"">https://youtu.be/d5Ufs9_O5ik</a><br><a href=""https://youtu.be/xXBPKoqnsX0"">https://youtu.be/xXBPKoqnsX0</a><br><a href=""https://youtu.be/Up_V7VCsQII"">https://youtu.be/Up_V7VCsQII</a><br>Its racism towards blacks sports people is famous.",0.0,0
Ugws_wmo1tbMdUlUcsV4AaABAg,"Ukraine will win the battle  because they R FIGHTING FOR THEIR LIVES, FAMILIES, LANDS, FREEDOM AND DEMOCRACY. hail to the soldiers and people volunteer as a soldier for their lovely COUNTRY-UKRAINE..",0.0,0
UgwTlp0JoR1ge-PQVBh4AaABAg,Wheres nato now? <br>Ukraine: can we join nato?<br>Nato: ummmmm no!<br>Ukraine: can you help fight in the war?<br>Nato: ummmm no!<br>Ukraine: can you declare a no fly zone?<br>Nato: ummmmm no!<br>Ukraine: what can you do?<br>Nato: turn you all into collateral damage.,0.0,0
UgxQwhH2PtiAyG2xf0V4AaABAg,"since most of the Russian army forces are focused on Ukraine, it&#39;s best time to conduct drone beheading on Putin back in Russia.",1.0,0
Ugyfv5L5icBsebZAecB4AaABAg,Support for Ukraine from Scotland 🏴󠁧󠁢󠁳󠁣󠁴󠁿 🇺🇦,1.0,0
UgyxqVIBOq0eRFUhxzZ4AaABAg,"This is sickening. they hate blacks but copy  blacks. <br>fdt<br>denazify ukraine, then america",0.5,1
UgxbhP4T05SmuGUj7FB4AaABAg,"This makes my heart melt because Russian &amp; Ukranian people I have met are so nice and genuine inside ... but there&#39;s always a bitter sweetness because of the oppression upon them. In this video I saw a glimpse of what it could be like to have a truly modern Russian culture that is liberal and free spirited. They deserve to have access to that. It&#39;s the current leaders who are putting us all against each other, the average person just wants to live conflict free these days.",0.37142857142857144,0
UgyJQNe-W3DSwEwOcv94AaABAg,Welp...at first I was all about supporting Ukraine...when they showed their true colors and discriminated against evacuating Africans/Blacks...FUCK EM...let Russia consume them.<br>My hard earn tax dollars pay for any aid/troops yadda yadda...fuckem,0.5,1
UgyZLpJGs5c0j8Gh7PN4AaABAg,👀💬id like to see forms of fiscal tracking over time here as well,1.0,0
UgyWrpDVi79DeUedXlJ4AaABAg,"All Russian citizens need to speak up and stand up to your government, anything otherwise is a cowardly move. Stand up.",1.0,0
UgzNYe6WyU3YboELh714AaABAg,"Arnie&#39;s speech touched my feelings ...<br><br>and then I thought, why did Arnold say nothing about the war in the Donbass that has been going on for more than 8 years, where thousands of peaceful Russian-speaking citizens have died at the hands of the Ukrainian nationalist group Azov, which is now actively supported by the President of Ukraine?<br><br>Why does Arnie say nothing about NATO&#39;s illegal expansion to the east and into post-Soviet territories that share a common border with Russia, such as Ukraine, which poses a threat to Russia&#39;s security?<br><br>Why is Arnie not saying anything about the US military biological laboratories in Ukraine, near the Russian border, to which Ms Nuland confessed at a press conference?<br><br>and then I thought - oh yes, indeed - Arnie is an actor! He deserves an Oscar for this brilliant speech!",0.0,0
UgyoU-sIHhKK1G6CI1B4AaABAg,"As a Russian, I want to apologize to Arnold for all the troubles and hurt and menal issues we caused his dad when he as an officer of SS department, which is regarded as the department who employed 99% of war criminals and sadists, invaded our country and pillaged, killed, raped us, but we fought back and caused this trauma. Please know Arnie, we are ashamed for it and want to apologize to you for not letting your dad and his brethren eliminate our race thus provoking his justified hate to us.",1.0,0
UgyW341TcjMvLz2LeAN4AaABAg,He should have also addressed the Us and NATO to stop expanding towards Russia as they already agreed in the past!,0.0,0
